A1: year | B1: return | C1: total
A2: 0 | B2: 0 | C2: 1000
A3: 1 | B3: 0.25 | C3: =C2+C2*B3 -> 1250
A4: 2 | B4: 0.15 | C4: =C3+C3*B4 -> 1437.5
A5: 3 | B5: 0.05 | C5: =C4+C4*B5 -> 1509.375
A6: 4 | B6: -0.05 | C6: =C5+C5*B6 -> 1433.90625
A7: 5 | B7: -0.15 | C7: =C6+C6*B7 -> 1218.8203125

A1: year | B1: return | C1: total
A2: 0 | B2: 0 | C2: 1000
A3: 1 | B3: -0.15 | C3: =C2+C2*B3 -> 850
A4: 2 | B4: -0.05 | C4: =C3+C3*B4 -> 807.5
A5: 3 | B5: 0.05 | C5: =C4+C4*B5 -> 847.875
A6: 4 | B6: 0.15 | C6: =C5+C5*B6 -> 975.05624999999998
A7: 5 | B7: 0.25 | C7: =C6+C6*B7 -> 1218.8203125

A1: year | B1: return | C1: total
A2: 0 | B2: 0 | C2: 1000
A3: 1 | B3: 0.25 | C3: =C2+C2*B3 -> 1250
A4: 2 | B4: -0.15 | C4: =C3+C3*B4 -> 1062.5
A5: 3 | B5: 0.05 | C5: =C4+C4*B5 -> 1115.625
A6: 4 | B6: 0.15 | C6: =C5+C5*B6 -> 1282.96875
A7: 5 | B7: -0.05 | C7: =C6+C6*B7 -> 1218.8203125

A1: year | B1: return | C1: total
A2: 0 | B2: 0 | C2: 1000
A3: 1 | B3: 0.05 | C3: =C2+C2*B3 -> 1050
A4: 2 | B4: 0.05 | C4: =C3+C3*B4 -> 1102.5
A5: 3 | B5: 0.05 | C5: =C4+C4*B5 -> 1157.625
A6: 4 | B6: 0.05 | C6: =C5+C5*B6 -> 1215.5062499999999
A7: 5 | B7: 0.05 | C7: =C6+C6*B7 -> 1276.2815624999998

A1: year | B1: return | C1: total
A2: 0 | B2: 0 | C2: 1000
A3: 1 | B3: 4.0370000000000003E-2 | C3: =C2+C2*B3 -> 1040.37
A4: 2 | B4: 4.0370000000000003E-2 | C4: =C3+C3*B4 -> 1082.3697368999999
A5: 3 | B5: 4.0370000000000003E-2 | C5: =C4+C4*B5 -> 1126.0650031786529
A6: 4 | B6: 4.0370000000000003E-2 | C6: =C5+C5*B6 -> 1171.5242473569751
A7: 5 | B7: 4.0370000000000003E-2 | C7: =C6+C6*B7 -> 1218.8186812227761

A1: year | B1: return | C1: total
A2: 0 | B2: 0 | C2: 1000
A3: 1 | B3: 0.25 | C3: =C2*(1+B3) -> 1250
A4: 2 | B4: -0.15 | C4: =C3*(1+B4) -> 1062.5
A5: 3 | B5: 0.05 | C5: =C4*(1+B5) -> 1115.625
A6: 4 | B6: 0.15 | C6: =C5*(1+B6) -> 1282.96875
A7: 5 | B7: -0.05 | C7: =C6*(1+B7) -> 1218.8203125
A8: 6 | B8: 0.05 | C8: =C7*(1+B8) -> 1279.7613281250001
A9: 7 | B9: -0.25 | C9: =C8*(1+B9) -> 959.82099609375007
A10: 8 | B10: 0.4 | C10: =C9*(1+B10) -> 1343.7493945312501
A11: 9 | B11: -0.3 | C11: =C10*(1+B11) -> 940.62457617187499
A12: 10 | B12: 0.35 | C12: =C11*(1+B12) -> 1269.8431778320314

A1: year | B1: return | C1: total
A2: 0 | B2: 0 | C2: 1000
A3: 1 | B3: 0.25 | C3: =C2*(1+B3) -> 1250
A4: 2 | B4: -0.15 | C4: =C3*(1+B4) -> 1062.5
A5: 3 | B5: 0.05 | C5: =C4*(1+B5) -> 1115.625
A6: 4 | B6: 0.15 | C6: =C5*(1+B6) -> 1282.96875
A7: 5 | B7: -0.05 | C7: =C6*(1+B7) -> 1218.8203125
A8: 6 | B8: 0.25 | C8: =C7*(1+B8) -> 1523.525390625
A9: 7 | B9: -0.15 | C9: =C8*(1+B9) -> 1294.99658203125
A10: 8 | B10: 0.05 | C10: =C9*(1+B10) -> 1359.7464111328125
A11: 9 | B11: 0.15 | C11: =C10*(1+B11) -> 1563.7083728027342
A12: 10 | B12: -0.05 | C12: =C11*(1+B12) -> 1485.5229541625974